{"cases":[{"archetype_id":"stalker","case_id":"placeholder/biped_puppet_v1/seed-42/dark","command":["/opt/homebrew/bin/godot","--path","/Volumes/Untitled/HermesOffload/christopherwilloughby/.hermes/worktrees/the-synaptic-sea/procedural-biomass-assembly","--script","res://scripts/validation/biomass_visual_review.gd","--","--recipe-id","biped_puppet_v1","--seed","42","--archetype-id","stalker","--lighting","dark","--visual-stage","placeholder","--output","/Volumes/Untitled/HermesOffload/christopherwilloughby/.hermes/worktrees/the-synaptic-sea/procedural-biomass-assembly/artifacts/validation-previews/.biomass-assembly-placeholder.9ke3lfzb/biped_puppet_v1__seed-42__dark.png"],"exit_code":0,"lighting":"dark","output":{"byte_size":89341,"height":720,"path":"artifacts/validation-previews/biomass-assembly-placeholder/biped_puppet_v1__seed-42__dark.png","sha256":"1cd163830abce51c912d3ce77549b6a80834c9cbfbf3c1bb21fc1045088981f2","width":1280},"pass":true,"pool_membership":true,"recipe_document":{"attachments":[{"child_socket":"root_0","connector_part_id":"biomass_gunk_connector_v1","instance_id":"leg_left","parent_instance_id":"core","parent_socket":"limb_0","part_id":"biomass_human_arm_v1"},{"child_socket":"root_0","connector_part_id":"biomass_gunk_connector_v1","instance_id":"leg_right","parent_instance_id":"core","parent_socket":"limb_1","part_id":"biomass_human_arm_v1"},{"child_socket":"root_0","connector_part_id":"biomass_gunk_connector_v1","instance_id":"head","parent_instance_id":"core","parent_socket":"head_0","part_id":"biomass_animal_skull_v1"},{"child_socket":"root_0","connector_part_id":"biomass_gunk_connector_v1","instance_id":"left_claw","parent_instance_id":"leg_left","parent_socket":"distal_0","part_id":"biomass_claw_v1"}],"core":{"instance_id":"core","part_id":"biomass_humanoid_torso_v1"},"locomotion_hint":"biped","recipe_id":"biped_puppet_v1"},"recipe_id":"biped_puppet_v1","recipe_sha256":"a00b83969dc0c6d37ac0cdb94295edf000bf2d2c7a4a4b0273c3dbdc34003f72","runtime":{"aabb_extents_m":[1.9297170639038086,1.2300000190734863,0.4499998092651367],"attachments":4,"body_collision_layer":1,"body_collision_mask":1,"collision_count":9,"direct_body_collision_children":9,"disabled_connector_collision_count":4,"enabled_collision_count":5,"gait_delta_seconds":0.016666666666666666,"gait_frames":120,"lighting":{"ambient_color":[0.02500000037252903,0.04500000178813934,0.10000000149011612],"ambient_energy":0.1599999964237213,"applied":true,"emergency_accent_applied":false,"emergency_accent_energy":null,"emergency_accent_present":false,"fog_density":0.03200000151991844,"fog_enabled":true,"is_away":true,"key_light_applied":true,"key_light_color":[0.18000000715255737,0.2800000011920929,0.550000011920929],"key_light_energy":0.18000000715255737},"max_nodes":160,"max_triangles":24000,"nodes":58,"occurrences":9,"paired_visibility":{"changed_bbox_height":62,"changed_bbox_width":51,"changed_pixels":1634,"rgb_delta":0.43529413640499115},"primitive_mesh_parts":true,"ray_hit":true,"ray_miss_after_free":true,"triangles":17000,"wrapper_paths_empty":true},"seed":42,"stderr":"","stdout":"Initialize godot-rust (API v4.6.stable.official, runtime v4.7.1.stable.official, safeguards balanced)\nGodot Engine v4.7.1.stable.official.a13da4feb - https://godotengine.org\nMetal 4.0 - Forward+ - Using Device #0: Apple - Apple M4 (Apple9)\n\nThe Synaptic Sea coherent proof ship bootstrap loaded.\nPLAYABLE SHIP READY player_spawned=true camera_spawned=true objectives=5 collision_shapes=112\nBIOMASS COMPOSITE CASE PASS {\"archetype_id\":\"stalker\",\"camera_current\":true,\"camera_script_path\":\"res://scripts/camera/iso_camera_rig.gd\",\"case_id\":\"placeholder/biped_puppet_v1/seed-42/dark\",\"lighting\":\"dark\",\"loader_loaded\":true,\"main_scene_path\":\"res://scenes/main.tscn\",\"playable_ready_seen\":true,\"playable_started\":true,\"pool_membership\":true,\"recipe_id\":\"biped_puppet_v1\",\"recipe_sha256\":\"a00b83969dc0c6d37ac0cdb94295edf000bf2d2c7a4a4b0273c3dbdc34003f72\",\"runtime\":{\"aabb_extents_m\":[1.9297170639038086,1.2300000190734863,0.4499998092651367],\"attachments\":4,\"body_collision_layer\":1,\"body_collision_mask\":1,\"collision_count\":9,\"direct_body_collision_children\":9,\"disabled_connector_collision_count\":4,\"enabled_collision_count\":5,\"gait_delta_seconds\":0.016666666666666666,\"gait_frames\":120,\"lighting\":{\"ambient_color\":[0.02500000037252903,0.04500000178813934,0.10000000149011612],\"ambient_energy\":0.1599999964237213,\"applied\":true,\"emergency_accent_applied\":false,\"emergency_accent_energy\":null,\"emergency_accent_present\":false,\"fog_density\":0.03200000151991844,\"fog_enabled\":true,\"is_away\":true,\"key_light_applied\":true,\"key_light_color\":[0.18000000715255737,0.2800000011920929,0.550000011920929],\"key_light_energy\":0.18000000715255737},\"max_nodes\":160,\"max_triangles\":24000,\"nodes\":58,\"occurrences\":9,\"paired_visibility\":{\"changed_bbox_height\":62,\"changed_bbox_width\":51,\"changed_pixels\":1634,\"rgb_delta\":0.43529413640499115},\"primitive_mesh_parts\":true,\"ray_hit\":true,\"ray_miss_after_free\":true,\"triangles\":17000,\"wrapper_paths_empty\":true},\"seed\":42,\"standalone_nodes_created\":false,\"visual_stage\":\"placeholder\"}\n","visual_stage":"placeholder"},{"archetype_id":"stalker","case_id":"placeholder/biped_puppet_v1/seed-42/emergency","command":["/opt/homebrew/bin/godot","--path","/Volumes/Untitled/HermesOffload/christopherwilloughby/.hermes/worktrees/the-synaptic-sea/procedural-biomass-assembly","--script","res://scripts/validation/biomass_visual_review.gd","--","--recipe-id","biped_puppet_v1","--seed","42","--archetype-id","stalker","--lighting","emergency","--visual-stage","placeholder","--output","/Volumes/Untitled/HermesOffload/christopherwilloughby/.hermes/worktrees/the-synaptic-sea/procedural-biomass-assembly/artifacts/validation-previews/.biomass-assembly-placeholder.9ke3lfzb/biped_puppet_v1__seed-42__emergency.png"],"exit_code":0,"lighting":"emergency","output":{"byte_size":95542,"height":720,"path":"artifacts/validation-previews/biomass-assembly-placeholder/biped_puppet_v1__seed-42__emergency.png","sha256":"38f8b2540c5bf3ce22ca2dd348bf0054f8b07540dbcc6f4c31125f5a92bc2c83","width":1280},"pass":true,"pool_membership":true,"recipe_document":{"attachments":[{"child_socket":"root_0","connector_part_id":"biomass_gunk_connector_v1","instance_id":"leg_left","parent_instance_id":"core","parent_socket":"limb_0","part_id":"biomass_human_arm_v1"},{"child_socket":"root_0","connector_part_id":"biomass_gunk_connector_v1","instance_id":"leg_right","parent_instance_id":"core","parent_socket":"limb_1","part_id":"biomass_human_arm_v1"},{"child_socket":"root_0","connector_part_id":"biomass_gunk_connector_v1","instance_id":"head","parent_instance_id":"core","parent_socket":"head_0","part_id":"biomass_animal_skull_v1"},{"child_socket":"root_0","connector_part_id":"biomass_gunk_connector_v1","instance_id":"left_claw","parent_instance_id":"leg_left","parent_socket":"distal_0","part_id":"biomass_claw_v1"}],"core":{"instance_id":"core","part_id":"biomass_humanoid_torso_v1"},"locomotion_hint":"biped","recipe_id":"biped_puppet_v1"},"recipe_id":"biped_puppet_v1","recipe_sha256":"a00b83969dc0c6d37ac0cdb94295edf000bf2d2c7a4a4b0273c3dbdc34003f72","runtime":{"aabb_extents_m":[1.9297170639038086,1.2300000190734863,0.4499998092651367],"attachments":4,"body_collision_layer":1,"body_collision_mask":1,"collision_count":9,"direct_body_collision_children":9,"disabled_connector_collision_count":4,"enabled_collision_count":5,"gait_delta_seconds":0.016666666666666666,"gait_frames":120,"lighting":{"ambient_color":[0.2199999988079071,0.03500000014901161,0.019999999552965164],"ambient_energy":0.3799999952316284,"applied":true,"emergency_accent_applied":true,"emergency_accent_energy":0.1599999964237213,"emergency_accent_present":true,"fog_density":0.03200000151991844,"fog_enabled":true,"is_away":true,"key_light_applied":true,"key_light_color":[1.0,0.2199999988079071,0.10000000149011612],"key_light_energy":0.6499999761581421},"max_nodes":160,"max_triangles":24000,"nodes":58,"occurrences":9,"paired_visibility":{"changed_bbox_height":117,"changed_bbox_width":130,"changed_pixels":3721,"rgb_delta":0.4392157047986984},"primitive_mesh_parts":true,"ray_hit":true,"ray_miss_after_free":true,"triangles":17000,"wrapper_paths_empty":true},"seed":42,"stderr":"","stdout":"Initialize godot-rust (API v4.6.stable.official, runtime v4.7.1.stable.official, safeguards balanced)\nGodot Engine v4.7.1.stable.official.a13da4feb - https://godotengine.org\nMetal 4.0 - Forward+ - Using Device #0: Apple - Apple M4 (Apple9)\n\nThe Synaptic Sea coherent proof ship bootstrap loaded.\nPLAYABLE SHIP READY player_spawned=true camera_spawned=true objectives=5 collision_shapes=112\nBIOMASS COMPOSITE CASE PASS {\"archetype_id\":\"stalker\",\"camera_current\":true,\"camera_script_path\":\"res://scripts/camera/iso_camera_rig.gd\",\"case_id\":\"placeholder/biped_puppet_v1/seed-42/emergency\",\"lighting\":\"emergency\",\"loader_loaded\":true,\"main_scene_path\":\"res://scenes/main.tscn\",\"playable_ready_seen\":true,\"playable_started\":true,\"pool_membership\":true,\"recipe_id\":\"biped_puppet_v1\",\"recipe_sha256\":\"a00b83969dc0c6d37ac0cdb94295edf000bf2d2c7a4a4b0273c3dbdc34003f72\",\"runtime\":{\"aabb_extents_m\":[1.9297170639038086,1.2300000190734863,0.4499998092651367],\"attachments\":4,\"body_collision_layer\":1,\"body_collision_mask\":1,\"collision_count\":9,\"direct_body_collision_children\":9,\"disabled_connector_collision_count\":4,\"enabled_collision_count\":5,\"gait_delta_seconds\":0.016666666666666666,\"gait_frames\":120,\"lighting\":{\"ambient_color\":[0.2199999988079071,0.03500000014901161,0.019999999552965164],\"ambient_energy\":0.3799999952316284,\"applied\":true,\"emergency_accent_applied\":true,\"emergency_accent_energy\":0.1599999964237213,\"emergency_accent_present\":true,\"fog_density\":0.03200000151991844,\"fog_enabled\":true,